,user_input,retrieved_contexts,response,reference,faithfulness,answer_relevancy,context_precision,context_recall
0,Jaka była wartość przychodów 'Total revenue' Allegro w Q1 2025?,"['\n# ALLEGRO.EU S.A.  GROUP\n## ZAŁĄCZNIK DO RAPORTU BIEŻĄCEGO NR 12/2025\n\n## Tabela 5.\n ## Wyniki Operacji Polskich\n\n| Skonsolidowane sprawozdanie z całkowitych dochodów<br>PLN m | Operacje Polskie |  |  |\n|---|---|---|---|\n|  | Q1 2025 | Q1 2024 | Zmiana % |\n| **GMV** | **14,778.7** | **13,569.7** | **8.9%** |\n| w tym 3P | 14,678.0 | 13,475.1 | 8.9% |\n| w tym 1P | 100.8 | 94.6 | 6.5% |\n| **Przychody całkowite i pozostałe przychody operacyjne** | **2,393.1** | **2,081.5** | **15.0%** |\n| **Przychody** | **2,368.0** | **2,051.3** | **15.4%** |\n| Przychody z marketplace | 1,846.7 | 1,640.9 | 12.5% |\n| Przychody z porównywarki cen | 61.1 | 54.2 | 12.9% |\n| Przychody z reklam | 295.8 | 228.7 | 29.4% |\n| Przychody ze sprzedaży detalicznej | 86.6 | 77.9 | 11.1% |\n| Przychody z usług logistycznych | 61.3 | 20.5 | 199.6% |\n| Pozostałe przychody | 16.4 | 29.2 | (43.8%) |\n| **Pozostałe przychody operacyjne** | **25.1** | **30.1** | **(16.7%)** |\n| **Koszty operacyjne** | **(1,563.2)** | **(1,289.4)** | **21.2%** |\n| Opłaty płatnicze | (34.9) | (36.5) | (4.4%) |\n| Koszt sprzedanych towarów | (81.1) | (70.1) | 15.8% |\n| Koszt dostawy | (747.9) | (584.4) | 28.0% |\n| Koszty usług marketingowych | (248.4) | (208.6) | 19.1% |\n| Koszty pracownicze | (294.7) | (246.3) | 19.6% |\n| Koszty usług IT | (59.7) | (44.4) | 34.5% |\n| Pozostałe koszty | (95.6) | (92.0) | 3.9% |\n| **Odpisy z tytułu utraty wartości aktywów finansowych i kontraktowych** | **(1.1)** | **(7.1)** | **(85.1%)** |\n| **Zysk operacyjny przed amortyzacją, deprecjacją i odpisami z tytułu utraty wartości aktywów trwałych niefinansowych (EBITDA)** | **829.9** | **792.0** | **4.8%** |\n\n## Najważniejsze informacje dotyczące Operacji Polskich w Q1 2025:\n\n● **Przychody z marketplace:** wzrost o 12,5% r/r osiągnięty dzięki wzrostowi GMV 3P o 8,9% r/r w połączeniu z wyższym o 0,4 pp wskaźnikiem Take Rate, głównie dzięki podwyżkom współfinansowania wdrożonym pod koniec marca 2024 r. Grupa ponownie zdecydowała się na wprowadzenie wszystkich istotnych zmian stawek na 2025 rok na początku tego roku, zapewniając sprzedawcom przejrzystą sytuację na cały rok i wystarczającą do absorpcji oczekiwanej inflacji kosztów dostawy w trakcie 2025 roku.\n\n ● **Przychody z reklam:** nadal rosły dynamicznie o 29,4% r/r i przewyższyły GMV, głównie dzięki ulepszonej propozycji wartości z poprawioną, kontekstową i opartą na AI trafnością dla użytkowników, co zwiększyło współczynnik klikalności oraz silną wycenę kosztu za kliknięcie dla Ofert Sponsorowanych.  Przychody z reklam jako procent GMV wzrosły do 2,00% w Q1 2025, o 0,32 pp w porównaniu z analogicznym okresem roku poprzedniego.\n', ""\n# RAPORT FINANSOWY - ALLEGRO.EU S.A.  GROUP\n## ZAŁĄCZNIK DO RAPORTU BIEŻĄCEGO NR 12/2025\n\n----\n\n## Kluczowe wyniki dla Segmentu Allegro International w Q1 2025:\n\n### GMV (Gross Merchandise Value)\n- GMV Segmentu Allegro International **wzrosło o 81,6% r/r** do **PLN 480,0 mln** w Q1 2025\n- Wzrost zgodny z rozszerzającą się bazą Aktywnych Kupujących, która zwiększyła się o **1,7 mln r/r**, osiągając **3,7 mln**\n- LTM GMV na Aktywnego Kupującego wzrosło z Q1 2024 o **13,3%** do **PLN 520,2**\n  - Z 3% r/r niekorzystnym wpływem kursów walutowych\n- Dynamiczny wzrost GMV częściowo odzwierciedla otwarcie nowych marketplace'ów na **Słowacji i Węgrzech** w 2024 roku, dołączających do czeskiego marketplace otwartego w maju 2023\n\n### Przychody\n- Wzrosły o **80,2% r/r**, osiągając **PLN 51,3 mln** w Q1 2025\n- Wzrost napędzany przez zwiększenie GMV\n- Nieznacznie zrównoważony przez obniżenie Take Rate do **7,21%** (spadek o **0,32 pp r/r**)\n  - Spowodowane rozmyciem przez opłaty promocyjne dla sprzedawców na marketplace'ach uruchomionych w zeszłym roku na Słowacji i Węgrzech\n\n### Skorygowana EBITDA\n- Strata dla Segmentu Allegro International wyniosła **PLN 60,9 mln** w Q1 2025\n- Odzwierciedla głównie:\n  - **PLN 59,2 mln** wydatków na marketing\n  - **PLN 28,9 mln** kosztów dostawy\n- Te wydatki są ponoszone w celu zwiększenia częstotliwości zakupów i przyciągnięcia nowych kupujących dla napędzenia wzrostu GMV\n- Koszty dostawy obejmują również koszty płatnych dostaw realizowanych przez czeską operację logistyczną Grupy, która sama jest częścią Segmentu Mall\n- Strata, wyrażona jako procent wygenerowanego GMV, **zmniejszyła się o 8,4 pp** z **21,1%** w Q1 2024 do **12,7%** w Q1 2025\n- Grupa ograniczała inwestycje marketingowe, kontynuując jednocześnie pracę nad ulepszeniami doświadczenia użytkownika w celu zwiększenia częstotliwości zakupów i wydatków na kupującego\n- Czynniki przyczyniające się do lepszych marż:\n  - Poprawa częstotliwości\n  - Poprawa konwersji\n  - Wzrost udziału darmowego ruchu\n  - Poprawa zwrotu z inwestycji w płatny ruch\n- Dodatkowo, koszty stałe personelu, IT i inne wydatki są teraz rozłożone na trzy marketplace'y, zwiększając efektywność\n\n----\n\n## Kluczowe wyniki dla Segmentu Mall w Q1 2025:\n\n### GMV (Gross Merchandise Value)\n- Zmniejszyło się o **53,4% r/r** do **PLN 229,9 mln**\n- Głównie w wyniku kampanii wyprzedaży zapasów w ciągu kwartału w celu redukcji zapasów przed zamknięciem front-endów Mall w **Czechach, na Słowacji i Węgrzech** pod koniec Q1 2025\n- Grupa kontynuowała zawężanie fokusa na produkty o wyższej marży i dążenie do lepszego zwrotu z inwestycji marketingowych\n- Redukcja o **46,5%** w liczbie sprzedanych produktów\n\n### Przychody\n- Ponieważ firmy Segmentu Mall coraz częściej sprzedają w modelu 1P (**88% GMV** w Q1 2024), większość spadku GMV przełożyła się na **45,6%** niższe przychody r/r\n\n### Skorygowana EBITDA\n- Strata poprawiła się r/r o **16,5%** do **PLN 48,4 mln** w Q1 2025\n- Poprawa pomimo spadku przychodów dzięki trwającej transformacji w kierunku szczupłego modelu sprzedawcy działającego na marketplace'ach\n- Rezultat dalszej optymalizacji kosztów marketingu i SG&A\n\n----\n\n**Strona 11**\n"", '\n# ALLEGRO.EU S.A.  GROUP\n## ATTACHMENT TO THE CURRENT REPORT NO.  12/2025\n\n### Table 4.\n ### Results of the Allegro.eu Group\n\n**Consolidated statement of comprehensive income**\n\n| PLN m | Q1 2025 | Q1 2024 | Change % |\n|-------|---------|---------|----------|\n| **GMV** | **15,445.0** | **14,305.0** | **8.0%** |\n| of which 3P | 15,141.6 | 13,798.1 | 9.7% |\n| of which 1P | 303.5 | 506.9 | (40.1%) |\n| **Total revenue and other operating income** | **2,622.4** | **2,475.3** | **5.9%** |\n| Revenue | 2,593.5 | 2,445.2 | 6.1% |\n| Marketplace revenue | 1,881.6 | 1,671.3 | 12.6% |\n| Price comparison revenue | 61.1 | 54.2 | 12.9% |\n| Advertising revenue | 301.2 | 230.1 | 30.9% |\n| Retail revenue | 257.0 | 421.3 | (39.0%) |\n| Logistic Service Revenue | 81.0 | 43.0 | 88.5% |\n| Other revenue | 11.7 | 25.3 | (53.8%) |\n| Other operating income | 28.9 | 30.1 | (4.2%) |\n| **Operating expenses** | **(1,911.8)** | **(1,804.0)** | **6.0%** |\n| Payment charges | (38.6) | (40.0) | (3.4%) |\n| Cost of goods sold | (227.3) | (371.2) | (38.8%) |\n| Cost of delivery | (786.1) | (609.9) | 28.9% |\n| Marketing service expenses | (317.1) | (287.6) | 10.2% |\n| Staff costs | (356.6) | (321.6) | 10.9% |\n| IT service expenses | (60.9) | (54.2) | 12.3% |\n| Other expenses | (119.7) | (110.8) | 8.0% |\n| Net impairment losses on financial and contract assets | (5.5) | (8.8) | (37.3%) |\n| **Operating profit before amortisation, depreciation and impairment losses of non-current non-financial assets (EBITDA)** | **710.6** | **671.3** | **5.9%** |\n\n----\n\n**Page 6**\n', '\n# RAPORT FINANSOWY - ALLEGRO.EU S.A.  GROUP\n## ZAŁĄCZNIK DO RAPORTU BIEŻĄCEGO NR 12/2025\n\n## Tabela 8.\n ## Uzgodnienie Całkowitych Dochodów Kompleksowych\n\n| Skonsolidowane sprawozdanie z całkowitych dochodów | Q1 2025 | Q1 2024 | Zmiana % |\n|---------------------------------------------------|---------|---------|----------|\n| **PLN m** | | | |\n| EBITDA Operacje Polskie | 829,9 | 792,0 | 4,8% |\n| EBITDA Operacje Międzynarodowe | (119,1) | (120,8) | 1,5% |\n| Eliminacje i Inne | (0,2) | 0,1 | (247,3%) |\n| **EBITDA** | **710,6** | **671,3** | **5,9%** |\n| Amortyzacja, deprecjacja i odpisy aktualizujące wartość długoterminowych aktywów niefinansowych | (229,0) | (235,4) | (2,7%) |\n| Amortyzacja | (160,9) | (174,0) | (7,6%) |\n| Deprecjacja | (67,8) | (61,1) | 10,9% |\n| Odpisy aktualizujące wartość długoterminowych aktywów niefinansowych | (0,4) | (0,3) | 34,0% |\n| **Zysk operacyjny** | **481,6** | **435,9** | **10,5%** |\n| Wynik finansowy netto | (88,5) | (91,8) | 3,7% |\n| Przychody finansowe | 39,6 | 23,4 | 68,9% |\n| Koszty finansowe | (122,3) | (90,7) | 34,8% |\n| Zyski/(straty) z tytułu różnic kursowych | (5,7) | (24,6) | 76,7% |\n| **Zysk przed opodatkowaniem** | **393,1** | **344,0** | **14,3%** |\n| Koszty podatku dochodowego | (96,6) | (102,2) | (5,5%) |\n| **Zysk netto** | **296,5** | **241,8** | **22,6%** |\n| Inne całkowite dochody/(straty) | (15,2) | 8,0 | (290,4%) |\n| **Całkowite dochody kompleksowe za okres** | **281,3** | **249,8** | **12,6%** |\n\n## Kluczowe informacje za Q1 2025:\n\n● **Wynik finansowy netto:** nieznacznie poprawił się o 3,7% dzięki wyższym przychodom finansowym i niższym stratom z tytułu różnic kursowych, częściowo zrównoważonym przez wyższe koszty finansowe.  Wzrost przychodów finansowych o 68,9% wynikał głównie z odsetek od rosnących sald środków pieniężnych i inwestycji krótkoterminowych.  Mniej zmienne kursy walutowe, szczególnie w stosunku do korony czeskiej, doprowadziły do niższych strat z tytułu różnic kursowych niż w roku poprzednim.  Koszty finansowe wzrosły o 34,8% r/r w Q1 2025 po wygaśnięciu w Q2 2024 wieloletnich kontraktów swap na stopę procentową, które były silnie zyskowne. ']","Wartość przychodów 'Total revenue' Allegro w Q1 2025 wynosiła PLN 2,593.5 mln.","2,622.4 mln PLN",,0.8994912184578582,0.999999999975,
1,O ile procent zmieniły się przychody 'Polish Operations' w Allegro r/r?,"['\n# ALLEGRO.EU S.A.  GROUP\n## ZAŁĄCZNIK DO RAPORTU BIEŻĄCEGO NR 12/2025\n\n## Tabela 5.\n ## Wyniki Operacji Polskich\n\n| Skonsolidowane sprawozdanie z całkowitych dochodów<br>PLN m | Operacje Polskie |  |  |\n|---|---|---|---|\n|  | Q1 2025 | Q1 2024 | Zmiana % |\n| **GMV** | **14,778.7** | **13,569.7** | **8.9%** |\n| w tym 3P | 14,678.0 | 13,475.1 | 8.9% |\n| w tym 1P | 100.8 | 94.6 | 6.5% |\n| **Przychody całkowite i pozostałe przychody operacyjne** | **2,393.1** | **2,081.5** | **15.0%** |\n| **Przychody** | **2,368.0** | **2,051.3** | **15.4%** |\n| Przychody z marketplace | 1,846.7 | 1,640.9 | 12.5% |\n| Przychody z porównywarki cen | 61.1 | 54.2 | 12.9% |\n| Przychody z reklam | 295.8 | 228.7 | 29.4% |\n| Przychody ze sprzedaży detalicznej | 86.6 | 77.9 | 11.1% |\n| Przychody z usług logistycznych | 61.3 | 20.5 | 199.6% |\n| Pozostałe przychody | 16.4 | 29.2 | (43.8%) |\n| **Pozostałe przychody operacyjne** | **25.1** | **30.1** | **(16.7%)** |\n| **Koszty operacyjne** | **(1,563.2)** | **(1,289.4)** | **21.2%** |\n| Opłaty płatnicze | (34.9) | (36.5) | (4.4%) |\n| Koszt sprzedanych towarów | (81.1) | (70.1) | 15.8% |\n| Koszt dostawy | (747.9) | (584.4) | 28.0% |\n| Koszty usług marketingowych | (248.4) | (208.6) | 19.1% |\n| Koszty pracownicze | (294.7) | (246.3) | 19.6% |\n| Koszty usług IT | (59.7) | (44.4) | 34.5% |\n| Pozostałe koszty | (95.6) | (92.0) | 3.9% |\n| **Odpisy z tytułu utraty wartości aktywów finansowych i kontraktowych** | **(1.1)** | **(7.1)** | **(85.1%)** |\n| **Zysk operacyjny przed amortyzacją, deprecjacją i odpisami z tytułu utraty wartości aktywów trwałych niefinansowych (EBITDA)** | **829.9** | **792.0** | **4.8%** |\n\n## Najważniejsze informacje dotyczące Operacji Polskich w Q1 2025:\n\n● **Przychody z marketplace:** wzrost o 12,5% r/r osiągnięty dzięki wzrostowi GMV 3P o 8,9% r/r w połączeniu z wyższym o 0,4 pp wskaźnikiem Take Rate, głównie dzięki podwyżkom współfinansowania wdrożonym pod koniec marca 2024 r. Grupa ponownie zdecydowała się na wprowadzenie wszystkich istotnych zmian stawek na 2025 rok na początku tego roku, zapewniając sprzedawcom przejrzystą sytuację na cały rok i wystarczającą do absorpcji oczekiwanej inflacji kosztów dostawy w trakcie 2025 roku.\n\n ● **Przychody z reklam:** nadal rosły dynamicznie o 29,4% r/r i przewyższyły GMV, głównie dzięki ulepszonej propozycji wartości z poprawioną, kontekstową i opartą na AI trafnością dla użytkowników, co zwiększyło współczynnik klikalności oraz silną wycenę kosztu za kliknięcie dla Ofert Sponsorowanych.  Przychody z reklam jako procent GMV wzrosły do 2,00% w Q1 2025, o 0,32 pp w porównaniu z analogicznym okresem roku poprzedniego.\n', '\n# ALLEGRO.EU S.A.  GROUP\n## ATTACHMENT TO THE CURRENT REPORT NO.  12/2025\n\n### Appendix 1.  Summary of consolidated statements of comprehensive income for the Group (unaudited)\n\n| Consolidated statement of comprehensive income | Polish Operations |  |  | International Operations |  |  | Eliminations |  |  | Total |  |  |\n|---|---|---|---|---|---|---|---|---|---|---|---|---|\n| PLN m | Q1 2025 | Q1 2024 | Change % | Q1 2025 | Q1 2024 | Change % | Q1 2025 | Q1 2024 | Change % | Q1 2025 | Q1 2024 | Change % |\n| **GMV** | 14,778.7 | 13,569.7 | 8.9% | 669.3 | 735.3 | (9.0%) | (3.0) | - | N/A | 15,445.0 | 14,305.0 | 8.0% |\n| of which 3P | 14,678.0 | 13,475.1 | 8.9% | 466.6 | 323.0 | 44.5% | (3.0) | - | N/A | 15,141.6 | 13,798.1 | 9.7% |\n| of which 1P | 100.8 | 94.6 | 6.5% | 202.7 | 412.3 | (50.8%) | - | - | N/A | 303.5 | 506.9 | (40.1%) |\n| **Total revenue and other operating income** | 2,393.1 | 2,081.5 | 15.0% | 240.1 | 405.8 | (40.8%) | (10.8) | (11.9) | (9.8%) | 2,622.4 | 2,475.3 | 5.9% |\n| **Revenue** | 2,368.0 | 2,051.3 | 15.4% | 236.3 | 405.8 | (41.8%) | (10.8) | (11.9) | (9.8%) | 2,593.5 | 2,445.2 | 6.1% |\n| Marketplace revenue | 1,846.7 | 1,640.9 | 12.5% | 35.2 | 30.4 | 15.7% | (0.4) | - | N/A | 1,881.6 | 1,671.3 | 12.6% |\n| Price comparison revenue | 61.1 | 54.2 | 12.9% | - | - | N/A | - | - | N/A | 61.1 | 54.2 | 12.9% |\n| Advertising revenue | 295.8 | 228.7 | 29.4% | 5.4 | 1.5 | 271.0% | - | - | N/A | 301.2 | 230.1 | 30.9% |\n| Retail revenue | 86.6 | 77.9 | 11.1% | 170.4 | 347.9 | (51.0%) | - | (4.5) | (100.0%) | 257.0 | 421.3 | (39.0%) |\n| Logistic Service Revenue | 61.3 | 20.5 | 199.6% | 19.7 | 22.5 | (12.6%) | - | - | N/A | 81.0 | 43.0 | 88.5% |\n| Other revenue | 16.4 | 29.2 | (43.8%) | 5.6 | 3.5 | 61.5% | (10.4) | (7.4) | 39.7% | 11.7 | 25.3 | (53.8%) |\n| **Other operating income** | 25.1 | 30.1 | (16.7%) | 3.8 | - | N/A | - | - | N/A | 28.9 | 30.1 | (4.2%) |\n| **Operating expenses** | (1,563.2) | (1,289.4) | 21.2% | (359.2) | (526.6) | (31.8%) | 10.6 | 12.0 | (12.0%) | (1,911.8) | (1,804.0) | 6.0% |\n| Payment charges | (34.9) | (36.5) | (4.4%) | (3.8) | (3.5) | 7.5% | - | - | N/A | (38.6) | (40.0) | (3.4%) |\n| Cost of goods sold | (81.1) | (70.1) | 15.8% | (146.4) | (305.6) | (52.1%) | 0.2 | 4.5 | (94.6%) | (227.3) | (371.2) | (38.8%) |\n| Cost of delivery | (747.9) | (584.4) | 28.0% | (38.3) | (25.4) | 50.4% | - | - | N/A | (786.1) | (609.9) | 28.9% |\n| Marketing service expenses | (248.4) | (208.6) | 19.1% | (68.8) | (79.0) | (13.0%) | 0.1 | - | N/A | (317.1) | (287.6) | 10.2% |\n| Staff costs | (294.7) | (246.3) | 19.6% | (62.0) | (75.3) | (17.6%) | 0.1 | - | N/A | (356.6) | (321.6) | 10.9% |\n| IT service expenses | (59.7) | (44.4) | 34.5% | (9.4) | (13.1) | (28.5%) | 8.1 | 3.3 | 149.9% | (60.9) | (54.2) | 12.3% |\n| Other expenses | (95.6) | (92.0) | 3.9% | (26.1) | (23.1) | 13.1% | 2.0 | 4.3 | (53.6%) | (119.7) | (110.8) | 8.0% |\n| **Net impairment losses on financial and contract assets** | (1.1) | (7.1) | (85.1%) | (4.4) | (1.6) | 174.0% | - | - | N/A | (5.5) | (8.8) | (37.3%) |\n| **Operating profit before amortisation, depreciation and impairment losses of non-current non-financial assets (EBITDA)** | 829.9 | 792.0 | 4.8% | (119.1) | (120.8) | 1.5% | (0.2) | 0.1 | (247.3%) | 710.6 | 671.3 | 5.9% |\n', '\n# RAPORT FINANSOWY - ALLEGRO.EU S.A.  GROUP\n## ZAŁĄCZNIK DO RAPORTU BIEŻĄCEGO NR 12/2025\n\n## Tabela 8.\n ## Uzgodnienie Całkowitych Dochodów Kompleksowych\n\n| Skonsolidowane sprawozdanie z całkowitych dochodów | Q1 2025 | Q1 2024 | Zmiana % |\n|---------------------------------------------------|---------|---------|----------|\n| **PLN m** | | | |\n| EBITDA Operacje Polskie | 829,9 | 792,0 | 4,8% |\n| EBITDA Operacje Międzynarodowe | (119,1) | (120,8) | 1,5% |\n| Eliminacje i Inne | (0,2) | 0,1 | (247,3%) |\n| **EBITDA** | **710,6** | **671,3** | **5,9%** |\n| Amortyzacja, deprecjacja i odpisy aktualizujące wartość długoterminowych aktywów niefinansowych | (229,0) | (235,4) | (2,7%) |\n| Amortyzacja | (160,9) | (174,0) | (7,6%) |\n| Deprecjacja | (67,8) | (61,1) | 10,9% |\n| Odpisy aktualizujące wartość długoterminowych aktywów niefinansowych | (0,4) | (0,3) | 34,0% |\n| **Zysk operacyjny** | **481,6** | **435,9** | **10,5%** |\n| Wynik finansowy netto | (88,5) | (91,8) | 3,7% |\n| Przychody finansowe | 39,6 | 23,4 | 68,9% |\n| Koszty finansowe | (122,3) | (90,7) | 34,8% |\n| Zyski/(straty) z tytułu różnic kursowych | (5,7) | (24,6) | 76,7% |\n| **Zysk przed opodatkowaniem** | **393,1** | **344,0** | **14,3%** |\n| Koszty podatku dochodowego | (96,6) | (102,2) | (5,5%) |\n| **Zysk netto** | **296,5** | **241,8** | **22,6%** |\n| Inne całkowite dochody/(straty) | (15,2) | 8,0 | (290,4%) |\n| **Całkowite dochody kompleksowe za okres** | **281,3** | **249,8** | **12,6%** |\n\n## Kluczowe informacje za Q1 2025:\n\n● **Wynik finansowy netto:** nieznacznie poprawił się o 3,7% dzięki wyższym przychodom finansowym i niższym stratom z tytułu różnic kursowych, częściowo zrównoważonym przez wyższe koszty finansowe.  Wzrost przychodów finansowych o 68,9% wynikał głównie z odsetek od rosnących sald środków pieniężnych i inwestycji krótkoterminowych.  Mniej zmienne kursy walutowe, szczególnie w stosunku do korony czeskiej, doprowadziły do niższych strat z tytułu różnic kursowych niż w roku poprzednim.  Koszty finansowe wzrosły o 34,8% r/r w Q1 2025 po wygaśnięciu w Q2 2024 wieloletnich kontraktów swap na stopę procentową, które były silnie zyskowne. ', ""\n# ALLEGRO.EU S.A.  GROUP\n## ATTACHMENT TO THE CURRENT REPORT NO.  12/2025\n\n----\n\n## Part III.\n ## Targets and expectations for FY 2025\n\nTaking into consideration results of Q1 2025 and current trading the Group's expectations for full year 2025 remain unchanged and are summarized below:\n\n| PLN / % | Polish Operations | International Marketplaces | Mall Segment | Consolidated Group |\n|---------|------------------|---------------------------|--------------|-------------------|\n| **GMV** | 66.2 - 67.4 bn<br>9-11% YoY growth | 2.4 - 2.5 bn<br>40-50% YoY growth | 0.6 - 0.8 bn<br>55-65% YoY decline | 69.2 - 70.7 bn<br>8-11% YoY growth |\n| **Revenue** | 10.8 - 11.1 bn<br>14-17% YoY growth | 0.26 - 0.27 bn<br>55-65% YoY growth | 0.6 - 0.8 bn<br>45-55% YoY decline | 11.7 - 12.1 bn<br>7-11% YoY growth |\n| **Adjusted EBITDA** | 3.9 - 4.0 bn<br>8-12% YoY growth | 0.35 - 0.40 bn loss<br>+/- 7% YoY change | 0.15 - 0.17 bn loss<br>20-30% YoY lower loss | 3.3 - 3.5 bn<br>10-17% YoY growth |\n| **CAPEX** | 0.85 - 1.0 bn<br>60-90% YoY growth | 40-50 m | 30-40 m | 0.95 - 1.1 bn<br>50-75% YoY growth |\n\n----\n\n16\n"", '\n# ALLEGRO.EU S.A.  GROUP\n## ZAŁĄCZNIK DO RAPORTU BIEŻĄCEGO NR 12/2025\n\n### Tabela 7.  Skonsolidowane sprawozdanie z całkowitych dochodów za okres trzech miesięcy zakończony 31 marca 2025 roku\n\n#### Operacje Międzynarodowe\n\n| Skonsolidowane sprawozdanie z całkowitych dochodów<br>PLN m | Segment Allegro International |  |  | Segment Mall |  |  | Eliminacje |  |  | Razem |  |  |\n|---|---|---|---|---|---|---|---|---|---|---|---|---|\n|  | Q1 2025 | Q1 2024 | Zmiana % | Q1 2025 | Q1 2024 | Zmiana % | Q1 2025 | Q1 2024 | Zmiana % | Q1 2025 | Q1 2024 | Zmiana % |\n| GMV | 480,0 | 264,4 | 81,6% | 229,9 | 493,0 | (53,4%) | (40,6) | (22,1) | 83,9% | 669,3 | 735,3 | (9,0%) |\n| w tym 3P | 480,0 | 264,4 | 81,6% | 27,2 | 80,7 | (66,3%) | (40,6) | (22,1) | 83,9% | 466,6 | 323,0 | 44,5% |\n| w tym 1P | - | - | N/A | 202,7 | 412,3 | (50,8%) | - | - | N/A | 202,7 | 412,3 | (50,8%) |\n| Przychody całkowite i pozostałe przychody operacyjne | 51,3 | 28,5 | 80,2% | 220,0 | 397,5 | (44,7%) | (31,1) | (20,1) | 54,5% | 240,1 | 405,8 | (40,8%) |\n| Przychody | 51,3 | 28,5 | 80,2% | 216,2 | 397,5 | (45,6%) | (31,1) | (20,1) | 54,5% | 236,3 | 405,8 | (41,8%) |\n| Przychody z marketplace | 34,6 | 19,9 | 73,8% | 3,2 | 11,6 | (72,7%) | (2,5) | (1,0) | 145,8% | 35,2 | 30,4 | 15,7% |\n| Przychody z reklam | 7,8 | 3,0 | 159,3% | 0,5 | 2,2 | (77,0%) | (2,9) | (3,7) | (22,3%) | 5,4 | 1,5 | 271,0% |\n| Przychody ze sprzedaży detalicznej | - | - | N/A | 170,4 | 348,6 | (51,1%) | - | (0,7) | (100,0%) | 170,4 | 347,9 | (51,0%) |\n| Przychody z usług logistycznych | 7,6 | 5,5 | 38,3% | 25,7 | 25,9 | (0,8%) | (13,7) | (9,0) | 52,7% | 19,7 | 22,5 | (12,6%) |\n| Pozostałe przychody | 1,2 | - | N/A | 16,4 | 9,2 | 78,2% | (12,0) | (5,7) | 109,7% | 5,6 | 3,5 | 61,5% |\n| Pozostałe przychody operacyjne | - | - | N/A | 3,8 | - | N/A | - | - | N/A | 3,8 | - | N/A |\n| Koszty operacyjne | (112,9) | (86,8) | 30,1% | (276,8) | (459,6) | (39,8%) | 30,5 | 19,8 | 54,1% | (359,2) | (526,6) | (31,8%) |\n| Opłaty płatnicze | (2,8) | (1,1) | 146,0% | (0,9) | (2,4) | (59,8%) | - | - | N/A | (3,8) | (3,5) | 7,5% |\n| Koszt sprzedanych towarów | - | - | N/A | (148,0) | (307,0) | (51,8%) | 1,5 | 1,4 | 6,1% | (146,4) | (305,6) | (52,1%) |\n| Koszt dostawy | (28,9) | (7,9) | 266,4% | (21,9) | (23,9) | (8,3%) | 12,6 | 6,4 | 97,0% | (38,3) | (25,4) | 50,4% |\n| Koszty usług marketingowych | (59,2) | (56,6) | 4,6% | (14,3) | (29,0) | (50,6%) | 4,8 | 6,6 | (27,3%) | (68,8) | (79,0) | (13,0%) |\n| Koszty wynagrodzeń | (9,1) | (12,6) | (28,1%) | (55,1) | (64,4) | (14,5%) | 2,1 | 1,8 | 19,3% | (62,0) | (75,3) | (17,6%) |\n| Koszty usług IT | (0,8) | (2,9) | (72,0%) | (8,7) | (10,2) | (15,4%) | 0,1 | - | N/A | (9,4) | (13,1) | (28,5%) |\n| Pozostałe koszty | (12,1) | (5,5) | 120,2% | (23,4) | (21,2) | 10,6% | 9,4 | 3,6 | 160,9% | (26,1) | (23,1) | 13,1% |\n| Odpisy z tytułu utraty wartości aktywów finansowych i kontraktowych | - | (0,1) | (100,0%) | (4,4) | (1,5) | 199,8% | - | - | N/A | (4,4) | (1,6) | 174,0% |\n| Zysk operacyjny przed amortyzacją, deprecjacją i odpisami z tytułu utraty wartości długoterminowych aktywów niefinansowych (EBITDA) | (61,6) | (58,3) | (5,7%) | (56,8) | (62,2) | 8,6% | (0,6) | (0,3) | 77,1% | (119,1) | (120,8) | 1,5% |\n\n----\n\n**Strona 10**\n']",Przychody 'Polish Operations' w Allegro wzrosły o 14-17% r/r.,Wzrosły o 15.0%.,,0.8256385364988327,0.99999999998,
2,Kto jest Prezesem Zarządu ING Banku Śląskiego?,"['Wygasł również mandat Pana Sławomira Soszyńskiego, który 29 listopada 2024 roku złożył rezygnację z ubiegania się o wybór do składu Zarządu Banku następnej kadencji.\n\n Jednocześnie, 29 kwietnia 2025 roku, na podstawie uchwały Rady Nadzorczej z dnia 3 września 2024 roku oraz za zgodą Komisji Nadzoru Finansowego z 20 grudnia 2024 roku Pan Michał Bolesławski objął stanowisko Prezesa Zarządu Banku.  Również 29 kwietnia 2025 roku Rada Nadzorcza, na podstawie pozytywnej rekomendacji Komitetu Wynagrodzeń i Nominacji, zatwierdziła indywidualną i zbiorową ocenę odpowiedniości kandydatów na członków Zarządu Banku i tym samym powołała na nową kadencję Zarząd Banku w następującym składzie: Pani Joanna Erdman - Wiceprezes Zarządu Banku, Pan Marcin Giżycki - Wiceprezes Zarządu Banku, Pani Bożena Graczyk - Wiceprezes Zarządu Banku, Pan Marcin Kościński - Wiceprezes Zarządu Banku, Pan Michał H. Mrożek - Wiceprezes Zarządu Banku, Pan Maciej Ogórkiewicz - Wiceprezes Zarządu Banku, Pani Alicja Żyła - Wiceprezes Zarządu Banku.\n\n Ponadto, Rada Nadzorcza podjęła uchwałę o powołaniu w skład Zarządu Banku nowej kadencji Pani Ewy Łuniewskiej, z dniem wpisu do rejestru przedsiębiorców Krajowego Rejestru Sądowego zmiany w § 26 ust.1 Statutu ING Banku Śląskiego Spółka Akcyjna (dotyczącej liczby członków Zarządu Banku), objętej uchwałą nr 28 Zwyczajnego Walnego Zgromadzenia z dnia 29 kwietnia 2025 roku.  Zgodnie z ustaleniami z Panią Ewą Łuniewską będzie ona pełnić funkcję Wiceprezes Zarządu do dnia 31 grudnia 2025 roku.\n\n Pani Joanna Erdman, Pan Marcin Giżycki, Pani Bożena Graczyk, Pani Ewa Łuniewska, Pan Michał H. Mrożek oraz Pani Alicja Żyła pełnili funkcje w Zarządzie poprzedniej kadencji.\n\n ----\n\n**74** | ING Bank Śląski S.A. ', '## Prawdziwość i rzetelność prezentowanych sprawozdań\n\nWedle najlepszej wiedzy Zarządu Banku półroczne skrócone skonsolidowane sprawozdanie finansowe i dane porównywalne zostały sporządzone zgodnie z obowiązującymi zasadami rachunkowości oraz odzwierciedlają w sposób prawdziwy, rzetelny i jasny sytuację majątkową i finansową Grupy Kapitałowej Banku oraz jej wynik finansowy.  Zawarte w niniejszym dokumencie półroczne sprawozdanie Zarządu z działalności Grupy Kapitałowej Banku zawiera prawdziwy obraz rozwoju i osiągnięć oraz sytuacji Grupy Kapitałowej Banku w I półroczu 2025 roku, w tym opis podstawowych zagrożeń i ryzyka.\n\n ## PODPISY CZŁONKÓW ZARZĄDU ING BANKU ŚLĄSKIEGO S.A.\n\n | Data | Imię i Nazwisko | Stanowisko | Status podpisu |\n|------|-----------------|------------|----------------|\n| 2025-07-30 | Michał Bolesławski | Prezes Zarządu Banku | Podpisano kwalifikowanym podpisem elektronicznym |\n| 2025-07-30 | Joanna Erdman | Wiceprezes Zarządu Banku | Podpisano kwalifikowanym podpisem elektronicznym |\n| 2025-07-30 | Marcin Giżycki | Wiceprezes Zarządu Banku | Podpisano kwalifikowanym podpisem elektronicznym |\n| 2025-07-30 | Bożena Graczyk | Wiceprezes Zarządu Banku | Podpisano kwalifikowanym podpisem elektronicznym |\n| 2025-07-30 | Marcin Kościński | Wiceprezes Zarządu Banku | Podpisano kwalifikowanym podpisem elektronicznym |\n| 2025-07-30 | Ewa Łuniewska | Wiceprezes Zarządu Banku | Podpisano kwalifikowanym podpisem elektronicznym |\n| 2025-07-30 | Michał H. Mrożek | Wiceprezes Zarządu Banku | Podpisano kwalifikowanym podpisem elektronicznym |\n| 2025-07-30 | Maciej Ogórkiewicz | Wiceprezes Zarządu Banku | Podpisano kwalifikowanym podpisem elektronicznym |\n| 2025-07-30 | Alicja Żyła | Wiceprezes Zarządu Banku | Podpisano kwalifikowanym podpisem elektronicznym |\n\n----\n\n*84 | ING Bank Śląski S.A.  | Sprawozdanie Zarządu z działalności Grupy Kapitałowej ING Banku Śląskiego S.A.  w I półroczu 2025 roku*', '\n# RAPORT FINANSOWY - WYNAGRODZENIA I NIEZALEŻNOŚĆ ORGANÓW\n\n## Stan posiadania akcji banku przez członków Zarządu na 30 czerwca 2025 – zgodnie z ich przyznaniem w 2025 roku\n\n| Członek Zarządu | Liczba akcji |\n|----------------|--------------|\n| p. Joanna Erdman | 1 443 |\n| p. Marcin Giżycki | 1 569 |\n| p. Bożena Graczyk | 1 565 |\n| p. Marcin Kościński | 713 |\n| p. Ewa Łuniewska | 1 272 |\n| p. Michał H. Mrożek | 1 272 |\n| p. Maciej Ogórkiewicz | 13 |\n| p. Alicja Żyła | 1 201 |\n| **Łącznie** | **9 048** |\n\n## Informacje o instrumentach finansowych odroczonych\n\nIV i V transza nabytych akcji stanowi:\n- Drugą część instrumentów finansowych odroczonych przyznanych za okres od 1 lipca do 31 grudnia 2022 roku\n- Pierwszą część instrumentów finansowych odroczonych przyznanych za okres od 1 stycznia do 31 grudnia 2023 roku\n- Nieodroczoną część instrumentów finansowych za okres od 1 stycznia do 31 grudnia 2024 roku\n\n### Okresy przetrzymania akcji:\n\nAkcje podlegają okresowi przetrzymania wynoszącemu jeden rok od daty przyznania:\n- **Członkowie Zarządu**: transakcje na nabytych akcjach mogą nastąpić po 20 marca 2026 roku\n- **Pozostali Identified Staff**: \n  - Pracownicy banku: po 18 marca 2026 roku\n  - Pracownicy spółek zależnych banku: po 31 marca 2026 roku\n\n## Niezależność członków Rady Nadzorczej i Komitetów Rady\n\n### Wymagania statutowe:\n\nZgodnie z § 19 ust.  3 Statutu Banku, w skład Rady Nadzorczej powinni wchodzić przynajmniej dwaj członkowie wolni od jakichkolwiek powiązań z bankiem, jego akcjonariuszami lub pracownikami.\n\n Zgodnie z § 22 ust.  6 Statutu Banku, kryteria niezależności powinna spełniać większość członków Komitetów Rady (Komitetu Audytu, Komitetu Wynagrodzeń i Nominacji oraz Komitetu Ryzyka), w tym przewodniczący tych Komitetów.\n\n']",Michał Bolesławski,Michał Bolesławski,1.0,,0.9999999999,1.0
3,Jaki był zysk netto Allegro w Q4 2025?,"['\n# ALLEGRO.EU S.A.  GROUP\n## ZAŁĄCZNIK DO RAPORTU BIEŻĄCEGO NR 12/2025\n\n### Część I:\n\n**Wybrane skonsolidowane dane finansowe i operacyjne (niebadane)**\n\n----\n\n#### Tabela 1.\n **Wybrane historyczne skonsolidowane informacje finansowe**\n\n**Rachunek zysków i strat**\n\n| PLN m | Q1 2025 | Q1 2024 | Zmiana % |\n|-------|---------|---------|----------|\n| **Przychody całkowite i pozostałe przychody operacyjne** | 2 622,4 | 2 475,3 | 5,9% |\n| w tym Działalność Polska | 2 393,1 | 2 081,5 | 15,0% |\n| w tym Działalność Międzynarodowa | 240,1 | 405,8 | (40,8%) |\n| w tym Wyłączenia i Pozostałe | (10,8) | (11,9) | (9,8%) |\n| **EBITDA** | 710,6 | 671,3 | 5,9% |\n| w tym Działalność Polska | 829,9 | 792,0 | 4,8% |\n| w tym Działalność Międzynarodowa | (119,1) | (120,8) | 1,5% |\n| w tym Wyłączenia i Pozostałe | (0,2) | 0,1 | (247,3%) |\n| **Skorygowana EBITDA** | 749,3 | 706,2 | 6,1% |\n| w tym Działalność Polska | 859,4 | 820,2 | 4,8% |\n| w tym Działalność Międzynarodowa | (110,0) | (114,1) | 3,7% |\n| w tym Wyłączenia i Pozostałe | (0,2) | 0,1 | (247,3%) |\n| **EBIT** | 481,6 | 435,9 | 10,5% |\n| **Zysk przed opodatkowaniem** | 393,1 | 344,0 | 14,3% |\n| **Zysk netto** | 296,5 | 241,8 | 22,6% |\n\n----\n\n**Bilans**\n\n| PLN m | 31.03.2025<br>(niebadane) | 31.12.2024<br>(badane) | Zmiana % |\n|-------|---------|---------|----------|\n| **Aktywa** | 19 630,2 | 19 517,3 | 0,6% |\n| **Kapitał własny** | 10 407,1 | 10 087,2 | 3,2% |\n| **Dług netto** | 2 563,0 | 2 303,0 | 11,3% |\n\n----\n\n**Przepływy pieniężne**\n\n| PLN m | Q1 2025 | Q1 2024 | Zmiana % |\n|-------|---------|---------|----------|\n| **Przepływy pieniężne netto z działalności operacyjnej** | 165,6 | 1 133,8 | (85,4%) |\n| **Przepływy pieniężne netto z działalności inwestycyjnej** | (278,4) | (125,2) | 122,3% |\n| **Przepływy pieniężne netto z działalności finansowej** | (146,7) | (126,3) | 16,1% |\n| **Wpływ zmian kursów walut na środki pieniężne** | (1,9) | (4,3) | (55,9%) |\n| **Całkowity wzrost / (spadek) środków pieniężnych i ich ekwiwalentów** | (261,4) | 878,0 | (129,8%) |\n\n----\n\n1\n', '\n# ALLEGRO.EU S.A.  GROUP\n## ZAŁĄCZNIK DO RAPORTU BIEŻĄCEGO NR 12/2025\n\n## Tabela 9.\n ## Przegląd wyników przepływów pieniężnych\n\n| Przepływy pieniężne<br>mln PLN (niebadane) | Q1 2025 | Q1 2024 | Zmiana % |\n|---------------------------------------------|---------|---------|----------|\n| **Przepływy pieniężne netto z działalności operacyjnej (wpływ/wypływ)** | 165,6 | 1 133,8 | (85,4%) |\n| Zysk przed opodatkowaniem | 393,1 | 344,0 | 14,3% |\n| Zapłacony podatek dochodowy | (233,0) | (103,4) | 125,3% |\n| Amortyzacja i odpisy aktualizujące wartość długoterminowych aktywów niefinansowych | 229,0 | 235,4 | (2,7%) |\n| Koszty odsetek netto | 113,3 | 77,8 | 45,7% |\n| Zmiany w kapitale obrotowym netto | (379,1) | 526,8 | (172,0%) |\n| Pozostałe pozycje przepływów pieniężnych z działalności operacyjnej | 42,2 | 53,2 | (20,7%) |\n| **Przepływy pieniężne netto z działalności inwestycyjnej (wpływ/wypływ)** | (278,4) | (125,2) | 122,3% |\n| Skapitalizowane koszty rozwoju | (126,0) | (87,4) | 44,1% |\n| w tym Działalność Polska | (120,0) | (78,4) | 53,0% |\n| w tym Działalność Międzynarodowa | (6,0) | (9,0) | (33,3%) |\n| Pozostałe nakłady inwestycyjne | (79,3) | (38,0) | 108,6% |\n| w tym Działalność Polska | (68,6) | (36,9) | 86,2% |\n| w tym Działalność Międzynarodowa | (10,7) | (1,2) | 814,4% |\n| Zakup jednostek funduszy inwestycyjnych | (75,0) | - | N/A |\n| Pozostałe przepływy pieniężne z działalności inwestycyjnej | 1,9 | 0,3 | 667,5% |\n| **Przepływy pieniężne netto z działalności finansowej (wpływ/wypływ)** | (146,7) | (126,3) | 16,1% |\n| Zapłacone odsetki | (104,3) | (121,0) | (13,8%) |\n| Rozliczenia instrumentów zabezpieczających stopy procentowe | 5,9 | 46,4 | (87,2%) |\n| Płatności leasingowe | (47,6) | (45,3) | 5,1% |\n| Pozostałe przepływy pieniężne z działalności finansowej | (0,7) | (6,5) | (88,9%) |\n| **Wzrost/(spadek) netto środków pieniężnych i ich ekwiwalentów** | (259,5) | 882,3 | (129,4%) |\n| Wpływ zmian kursów walut na posiadane środki pieniężne | (1,9) | (4,3) | (55,9%) |\n\n## Najważniejsze informacje:\n\n● **Zapłacony podatek dochodowy:** wzrost o 125,3% zapłaconego podatku dochodowego wynika głównie z różnicy w rozliczaniu podatku dochodowego od osób prawnych w 2023 i 2024 roku.  W 2024 roku Grupa wybrała uproszczoną, ryczałtową formę miesięcznych zaliczek na podatek dochodowy, co spowodowało, że większa część pełnego zobowiązania podatkowego za 2024 rok została rozliczona w płatności końcowej w Q1 2025.\n\n ● **Zmiany w kapitale obrotowym netto:** spadek kapitału obrotowego netto o 906,0 mln PLN r/r w Q1 2025 wynika głównie z dwóch czynników: (i) przejście na potrącanie prowizji sprzedawców u źródła, co zmniejszyło należności o 544 mln PLN w Q1 2024 oraz (ii) wzrost bilansowych kredytów konsumenckich o 325,7 mln PLN, tj.  o 19,6% r/r. ', '\n# RAPORT FINANSOWY - ALLEGRO.EU S.A.  GROUP\n## ZAŁĄCZNIK DO RAPORTU BIEŻĄCEGO NR 12/2025\n\n## Tabela 8.\n ## Uzgodnienie Całkowitych Dochodów Kompleksowych\n\n| Skonsolidowane sprawozdanie z całkowitych dochodów | Q1 2025 | Q1 2024 | Zmiana % |\n|---------------------------------------------------|---------|---------|----------|\n| **PLN m** | | | |\n| EBITDA Operacje Polskie | 829,9 | 792,0 | 4,8% |\n| EBITDA Operacje Międzynarodowe | (119,1) | (120,8) | 1,5% |\n| Eliminacje i Inne | (0,2) | 0,1 | (247,3%) |\n| **EBITDA** | **710,6** | **671,3** | **5,9%** |\n| Amortyzacja, deprecjacja i odpisy aktualizujące wartość długoterminowych aktywów niefinansowych | (229,0) | (235,4) | (2,7%) |\n| Amortyzacja | (160,9) | (174,0) | (7,6%) |\n| Deprecjacja | (67,8) | (61,1) | 10,9% |\n| Odpisy aktualizujące wartość długoterminowych aktywów niefinansowych | (0,4) | (0,3) | 34,0% |\n| **Zysk operacyjny** | **481,6** | **435,9** | **10,5%** |\n| Wynik finansowy netto | (88,5) | (91,8) | 3,7% |\n| Przychody finansowe | 39,6 | 23,4 | 68,9% |\n| Koszty finansowe | (122,3) | (90,7) | 34,8% |\n| Zyski/(straty) z tytułu różnic kursowych | (5,7) | (24,6) | 76,7% |\n| **Zysk przed opodatkowaniem** | **393,1** | **344,0** | **14,3%** |\n| Koszty podatku dochodowego | (96,6) | (102,2) | (5,5%) |\n| **Zysk netto** | **296,5** | **241,8** | **22,6%** |\n| Inne całkowite dochody/(straty) | (15,2) | 8,0 | (290,4%) |\n| **Całkowite dochody kompleksowe za okres** | **281,3** | **249,8** | **12,6%** |\n\n## Kluczowe informacje za Q1 2025:\n\n● **Wynik finansowy netto:** nieznacznie poprawił się o 3,7% dzięki wyższym przychodom finansowym i niższym stratom z tytułu różnic kursowych, częściowo zrównoważonym przez wyższe koszty finansowe.  Wzrost przychodów finansowych o 68,9% wynikał głównie z odsetek od rosnących sald środków pieniężnych i inwestycji krótkoterminowych. ', '\n# RAPORT FINANSOWY - ALLEGRO.EU S.A.  GROUP\n## ZAŁĄCZNIK DO RAPORTU BIEŻĄCEGO NR 12/2025\n\n## Tabela 8.\n ## Uzgodnienie Całkowitych Dochodów Kompleksowych\n\n| Skonsolidowane sprawozdanie z całkowitych dochodów | Q1 2025 | Q1 2024 | Zmiana % |\n|---------------------------------------------------|---------|---------|----------|\n| **PLN m** | | | |\n| EBITDA Operacje Polskie | 829,9 | 792,0 | 4,8% |\n| EBITDA Operacje Międzynarodowe | (119,1) | (120,8) | 1,5% |\n| Eliminacje i Inne | (0,2) | 0,1 | (247,3%) |\n| **EBITDA** | **710,6** | **671,3** | **5,9%** |\n| Amortyzacja, deprecjacja i odpisy aktualizujące wartość długoterminowych aktywów niefinansowych | (229,0) | (235,4) | (2,7%) |\n| Amortyzacja | (160,9) | (174,0) | (7,6%) |\n| Deprecjacja | (67,8) | (61,1) | 10,9% |\n| Odpisy aktualizujące wartość długoterminowych aktywów niefinansowych | (0,4) | (0,3) | 34,0% |\n| **Zysk operacyjny** | **481,6** | **435,9** | **10,5%** |\n| Wynik finansowy netto | (88,5) | (91,8) | 3,7% |\n| Przychody finansowe | 39,6 | 23,4 | 68,9% |\n| Koszty finansowe | (122,3) | (90,7) | 34,8% |\n| Zyski/(straty) z tytułu różnic kursowych | (5,7) | (24,6) | 76,7% |\n| **Zysk przed opodatkowaniem** | **393,1** | **344,0** | **14,3%** |\n| Koszty podatku dochodowego | (96,6) | (102,2) | (5,5%) |\n| **Zysk netto** | **296,5** | **241,8** | **22,6%** |\n| Inne całkowite dochody/(straty) | (15,2) | 8,0 | (290,4%) |\n| **Całkowite dochody kompleksowe za okres** | **281,3** | **249,8** | **12,6%** |\n\n## Kluczowe informacje za Q1 2025:\n\n● **Wynik finansowy netto:** nieznacznie poprawił się o 3,7% dzięki wyższym przychodom finansowym i niższym stratom z tytułu różnic kursowych, częściowo zrównoważonym przez wyższe koszty finansowe.  Wzrost przychodów finansowych o 68,9% wynikał głównie z odsetek od rosnących sald środków pieniężnych i inwestycji krótkoterminowych.  Mniej zmienne kursy walutowe, szczególnie w stosunku do korony czeskiej, doprowadziły do niższych strat z tytułu różnic kursowych niż w roku poprzednim.  Koszty finansowe wzrosły o 34,8% r/r w Q1 2025 po wygaśnięciu w Q2 2024 wieloletnich kontraktów swap na stopę procentową, które były silnie zyskowne. ', '\n# ALLEGRO.EU S.A.  GROUP\n## ZAŁĄCZNIK DO RAPORTU BIEŻĄCEGO NR 12/2025\n\n### Tabela 7.  Skonsolidowane sprawozdanie z całkowitych dochodów za okres trzech miesięcy zakończony 31 marca 2025 roku\n\n#### Operacje Międzynarodowe\n\n| Skonsolidowane sprawozdanie z całkowitych dochodów<br>PLN m | Segment Allegro International |  |  | Segment Mall |  |  | Eliminacje |  |  | Razem |  |  |\n|---|---|---|---|---|---|---|---|---|---|---|---|---|\n|  | Q1 2025 | Q1 2024 | Zmiana % | Q1 2025 | Q1 2024 | Zmiana % | Q1 2025 | Q1 2024 | Zmiana % | Q1 2025 | Q1 2024 | Zmiana % |\n| GMV | 480,0 | 264,4 | 81,6% | 229,9 | 493,0 | (53,4%) | (40,6) | (22,1) | 83,9% | 669,3 | 735,3 | (9,0%) |\n| w tym 3P | 480,0 | 264,4 | 81,6% | 27,2 | 80,7 | (66,3%) | (40,6) | (22,1) | 83,9% | 466,6 | 323,0 | 44,5% |\n| w tym 1P | - | - | N/A | 202,7 | 412,3 | (50,8%) | - | - | N/A | 202,7 | 412,3 | (50,8%) |\n| Przychody całkowite i pozostałe przychody operacyjne | 51,3 | 28,5 | 80,2% | 220,0 | 397,5 | (44,7%) | (31,1) | (20,1) | 54,5% | 240,1 | 405,8 | (40,8%) |\n| Przychody | 51,3 | 28,5 | 80,2% | 216,2 | 397,5 | (45,6%) | (31,1) | (20,1) | 54,5% | 236,3 | 405,8 | (41,8%) |\n| Przychody z marketplace | 34,6 | 19,9 | 73,8% | 3,2 | 11,6 | (72,7%) | (2,5) | (1,0) | 145,8% | 35,2 | 30,4 | 15,7% |\n| Przychody z reklam | 7,8 | 3,0 | 159,3% | 0,5 | 2,2 | (77,0%) | (2,9) | (3,7) | (22,3%) | 5,4 | 1,5 | 271,0% |\n| Przychody ze sprzedaży detalicznej | - | - | N/A | 170,4 | 348,6 | (51,1%) | - | (0,7) | (100,0%) | 170,4 | 347,9 | (51,0%) |\n| Przychody z usług logistycznych | 7,6 | 5,5 | 38,3% | 25,7 | 25,9 | (0,8%) | (13,7) | (9,0) | 52,7% | 19,7 | 22,5 | (12,6%) |\n| Pozostałe przychody | 1,2 | - | N/A | 16,4 | 9,2 | 78,2% | (12,0) | (5,7) | 109,7% | 5,6 | 3,5 | 61,5% |\n| Pozostałe przychody operacyjne | - | - | N/A | 3,8 | - | N/A | - | - | N/A | 3,8 | - | N/A |\n| Koszty operacyjne | (112,9) | (86,8) | 30,1% | (276,8) | (459,6) | (39,8%) | 30,5 | 19,8 | 54,1% | (359,2) | (526,6) | (31,8%) |\n| Opłaty płatnicze | (2,8) | (1,1) | 146,0% | (0,9) | (2,4) | (59,8%) | - | - | N/A | (3,8) | (3,5) | 7,5% |\n| Koszt sprzedanych towarów | - | - | N/A | (148,0) | (307,0) | (51,8%) | 1,5 | 1,4 | 6,1% | (146,4) | (305,6) | (52,1%) |\n| Koszt dostawy | (28,9) | (7,9) | 266,4% | (21,9) | (23,9) | (8,3%) | 12,6 | 6,4 | 97,0% | (38,3) | (25,4) | 50,4% |\n| Koszty usług marketingowych | (59,2) | (56,6) | 4,6% | (14,3) | (29,0) | (50,6%) | 4,8 | 6,6 | (27,3%) | (68,8) | (79,0) | (13,0%) |\n| Koszty wynagrodzeń | (9,1) | (12,6) | (28,1%) | (55,1) | (64,4) | (14,5%) | 2,1 | 1,8 | 19,3% | (62,0) | (75,3) | (17,6%) |\n| Koszty usług IT | (0,8) | (2,9) | (72,0%) | (8,7) | (10,2) | (15,4%) | 0,1 | - | N/A | (9,4) | (13,1) | (28,5%) |\n| Pozostałe koszty | (12,1) | (5,5) | 120,2% | (23,4) | (21,2) | 10,6% | 9,4 | 3,6 | 160,9% | (26,1) | (23,1) | 13,1% |\n| Odpisy z tytułu utraty wartości aktywów finansowych i kontraktowych | - | (0,1) | (100,0%) | (4,4) | (1,5) | 199,8% | - | - | N/A | (4,4) | (1,6) | 174,0% |\n| Zysk operacyjny przed amortyzacją, deprecjacją i odpisami z tytułu utraty wartości długoterminowych aktywów niefinansowych (EBITDA) | (61,6) | (58,3) | (5,7%) | (56,8) | (62,2) | 8,6% | (0,6) | (0,3) | 77,1% | (119,1) | (120,8) | 1,5% |\n\n----\n\n**Strona 10**\n']",Nie ma informacji o zysku netto Allegro w Q4 2025.,Brak danych w raporcie (raport dotyczy tylko Q1).,,0.0,0.0,
